{
  "bottle": {
    "bottle_tag": "wasm32_kandelo",
    "bytes": 1016067,
    "cache_key_sha": "c67dcfe90a20808ade2d2662264e5bd1539e08c46062fb35dbaccd9708a55950",
    "cellar": "/home/linuxbrew/.linuxbrew/Cellar",
    "prefix": "/home/linuxbrew/.linuxbrew",
    "sha256": "d853cbef2e1f55db3995918c974adf83bd126a0c6ac0d2d3c80a9ff19ab44fdb",
    "url": "https://ghcr.io/v2/automattic/kandelo-homebrew/bash/blobs/sha256:d853cbef2e1f55db3995918c974adf83bd126a0c6ac0d2d3c80a9ff19ab44fdb"
  },
  "build": {
    "brew_version": "Homebrew 6.0.6",
    "dev_shell": "scripts/dev-shell.sh",
    "github_run": "https://github.com/local/kandelo/actions/runs/local",
    "job": "local",
    "runner_os": "local",
    "sdk_fingerprint": "a7ef0c406359039ee25d54e4f8baee3afdc857cdbcac5df9a065ef875b3a3b48",
    "sysroot_fingerprint": "d19b801e0da64ff3415019de982ee194ef093de68e1a08d25f41a82f07bcca98"
  },
  "formula": {
    "path": "Formula/bash.rb",
    "sha256": "d9cc81f75998a82fb099b89b831e21a78e9ab26ae8ef147784da7000d58cbc73"
  },
  "metadata": {
    "formula_json": {
      "path": "Kandelo/formula/bash.json",
      "sha256": "7a657f89a280bf4f65da9ece1266fed394148569d8a52ba3b7907bc2211af1ee"
    },
    "link_manifest_json": {
      "path": "Kandelo/link/bash-5.2.37-rebuild0-wasm32.json",
      "sha256": "ccd6b3f582684cf4fb8246658fa6a1b458e5af73af973855723d3efa90f8027a"
    },
    "metadata_json": {
      "path": "Kandelo/metadata.json",
      "sha256": "4f36b60899d0d14dbcac4b235cd0576b4e4cafb77b95aada980431aa28a64228"
    },
    "provenance_json": {
      "path": "Kandelo/reports/bash-5.2.37-rebuild0-wasm32.provenance.json",
      "sha256": "d7a0c5fb9330157f7aa3259bea2d1442166c2064826fe4d6de5573a4db2b3910"
    }
  },
  "repositories": {
    "kandelo_commit": "378a411abf24ce6c860575ce195e24d41659d034",
    "kandelo_repository": "Automattic/kandelo",
    "tap_commit": "378a411abf24ce6c860575ce195e24d41659d034",
    "tap_repository": "Automattic/kandelo-homebrew"
  },
  "schema": 1,
  "subject": {
    "arch": "wasm32",
    "bottle_rebuild": 0,
    "kandelo_abi": 16,
    "package": "bash",
    "version": "5.2.37"
  },
  "validation": {
    "outcome_lists": [
      {
        "failed": [],
        "name": "schema",
        "passed": [
          "Kandelo/metadata.json",
          "Kandelo/formula/bash.json",
          "Kandelo/link/bash-5.2.37-rebuild0-wasm32.json",
          "Kandelo/reports/bash-5.2.37-rebuild0-wasm32.provenance.json"
        ],
        "skipped": [],
        "status": "success"
      },
      {
        "failed": [],
        "name": "homebrew_audit",
        "passed": [],
        "skip_reason": "Tap audit can run in the trusted tap publication gate.",
        "skipped": [
          "brew audit was not part of this local dry-run verification"
        ],
        "status": "skipped"
      },
      {
        "failed": [],
        "name": "bottle_build",
        "passed": [
          "brew install --build-bottle",
          "brew test",
          "brew bottle --json --no-rebuild",
          "brew bottle --merge --write --no-commit"
        ],
        "skipped": [],
        "status": "success"
      },
      {
        "failed": [],
        "name": "node_smoke",
        "passed": [
          "Formula test ran bash utilities (infocmp -V) through node --import tsx/esm examples/run-example.ts"
        ],
        "skipped": [],
        "status": "success"
      },
      {
        "failed": [],
        "name": "browser_smoke",
        "passed": [],
        "skip_reason": "No successful browser VFS smoke was recorded for bash wasm32.",
        "skipped": [
          "No successful browser VFS smoke was recorded for bash wasm32."
        ],
        "status": "skipped"
      }
    ]
  }
}
