{
  "bottle": {
    "bottle_tag": "wasm32_kandelo",
    "bytes": 505439,
    "cache_key_sha": "4be127352be19f0d75448a83769107716757e545aa4f3790dca8069a093aab59",
    "cellar": "/home/linuxbrew/.linuxbrew/Cellar",
    "prefix": "/home/linuxbrew/.linuxbrew",
    "sha256": "5c9724cea03f33dbf62b4c3edafdc797d37f2ce060a8456fee3c9f50406db2f0",
    "url": "https://ghcr.io/v2/automattic/kandelo-homebrew/nano/blobs/sha256:5c9724cea03f33dbf62b4c3edafdc797d37f2ce060a8456fee3c9f50406db2f0"
  },
  "build": {
    "brew_version": "Homebrew 6.0.5",
    "dev_shell": "scripts/dev-shell.sh",
    "github_run": "https://github.com/local/kandelo/actions/runs/local",
    "job": "local",
    "runner_os": "local",
    "sdk_fingerprint": "a7ef0c406359039ee25d54e4f8baee3afdc857cdbcac5df9a065ef875b3a3b48",
    "sysroot_fingerprint": "d19b801e0da64ff3415019de982ee194ef093de68e1a08d25f41a82f07bcca98"
  },
  "formula": {
    "path": "Formula/nano.rb",
    "sha256": "969f255d25e14def893341bc3043e5eea8c2d2a0dfd3cccc5e43cdd5848e25a2"
  },
  "metadata": {
    "formula_json": {
      "path": "Kandelo/formula/nano.json",
      "sha256": "58053b573e1a843e25703410bf9a80ebaf270e646b495118e68c5df423aae30b"
    },
    "link_manifest_json": {
      "path": "Kandelo/link/nano-8.0-rebuild0-wasm32.json",
      "sha256": "123fe970d640a892b8ff526dd9d4f7ec6ed7865bb9fdf492433df2af334441c2"
    },
    "metadata_json": {
      "path": "Kandelo/metadata.json",
      "sha256": "79b0e916b5eb80845acc97871720e4741013bb97d2ed83dc3bbe00f511d6c332"
    },
    "provenance_json": {
      "path": "Kandelo/reports/nano-8.0-rebuild0-wasm32.provenance.json",
      "sha256": "f45accf2fc11ce831c8d1d02c7e6995721067261300160742f226b6e26243c41"
    }
  },
  "repositories": {
    "kandelo_commit": "1ab41fe2ad5553f4fa4bb0223f2d804b13149578",
    "kandelo_repository": "Automattic/kandelo",
    "tap_commit": "1ab41fe2ad5553f4fa4bb0223f2d804b13149578",
    "tap_repository": "Automattic/kandelo-homebrew"
  },
  "schema": 1,
  "subject": {
    "arch": "wasm32",
    "bottle_rebuild": 0,
    "kandelo_abi": 16,
    "package": "nano",
    "version": "8.0"
  },
  "validation": {
    "outcome_lists": [
      {
        "failed": [],
        "name": "schema",
        "passed": [
          "Kandelo/metadata.json",
          "Kandelo/formula/nano.json",
          "Kandelo/link/nano-8.0-rebuild0-wasm32.json",
          "Kandelo/reports/nano-8.0-rebuild0-wasm32.provenance.json"
        ],
        "skipped": [],
        "status": "success"
      },
      {
        "failed": [],
        "name": "homebrew_audit",
        "passed": [],
        "skip_reason": "Tap audit can run in the trusted tap publication gate.",
        "skipped": [
          "brew audit was not part of this local dry-run verification"
        ],
        "status": "skipped"
      },
      {
        "failed": [],
        "name": "bottle_build",
        "passed": [
          "brew install --build-bottle",
          "brew test",
          "brew bottle --json --no-rebuild",
          "brew bottle --merge --write --no-commit"
        ],
        "skipped": [],
        "status": "success"
      },
      {
        "failed": [],
        "name": "node_smoke",
        "passed": [
          "Formula test ran nano through node --import tsx/esm examples/run-example.ts"
        ],
        "skipped": [],
        "status": "success"
      },
      {
        "failed": [],
        "name": "browser_smoke",
        "passed": [],
        "skip_reason": "browser smoke not run in this local bottle verification pass; Node formula smoke passed",
        "skipped": [
          "browser smoke not run in this local bottle verification pass; Node formula smoke passed"
        ],
        "status": "skipped"
      }
    ]
  }
}
