{
  "schema": 1,
  "subject": {
    "package": "what",
    "version": "15.0.0",
    "arch": "wasm32",
    "bottle_rebuild": 0,
    "kandelo_abi": 15
  },
  "repositories": {
    "kandelo_repository": "Automattic/kandelo",
    "kandelo_commit": "2222222222222222222222222222222222222222",
    "tap_repository": "kandelo-dev/homebrew-tap-core",
    "tap_commit": "1111111111111111111111111111111111111111"
  },
  "formula": {
    "path": "Formula/what.rb",
    "sha256": "aaaaaaaaaaaaaaaaaaaaaaaaaaaaaaaaaaaaaaaaaaaaaaaaaaaaaaaaaaaaaaaa"
  },
  "bottle": {
    "url": "https://example.invalid/kandelo-homebrew/what-15.0.0-rebuild0-wasm32_kandelo.bottle.tar.gz",
    "sha256": "bbbbbbbbbbbbbbbbbbbbbbbbbbbbbbbbbbbbbbbbbbbbbbbbbbbbbbbbbbbbbbbb",
    "bytes": 12345,
    "cache_key_sha": "cccccccccccccccccccccccccccccccccccccccccccccccccccccccccccccccc",
    "bottle_tag": "wasm32_kandelo",
    "cellar": "/opt/kandelo/homebrew/Cellar",
    "prefix": "/opt/kandelo/homebrew"
  },
  "build": {
    "github_run": "https://example.invalid/kandelo-dev/homebrew-tap-core/actions/runs/1",
    "job": "publish-bottles",
    "runner_os": "ubuntu-24.04",
    "brew_version": "Homebrew 4.x fixture",
    "dev_shell": "scripts/dev-shell.sh fixture",
    "sdk_fingerprint": "dddddddddddddddddddddddddddddddddddddddddddddddddddddddddddddddd",
    "sysroot_fingerprint": "eeeeeeeeeeeeeeeeeeeeeeeeeeeeeeeeeeeeeeeeeeeeeeeeeeeeeeeeeeeeeeee"
  },
  "validation": {
    "outcome_lists": [
      {
        "name": "schema",
        "status": "success",
        "passed": [
          "metadata.json",
          "formula/what.json",
          "link/what-15.0.0-rebuild0-wasm32.json",
          "reports/what-15.0.0-rebuild0-wasm32.provenance.json"
        ],
        "failed": [],
        "skipped": []
      },
      {
        "name": "homebrew_audit",
        "status": "skipped",
        "passed": [],
        "failed": [],
        "skipped": ["schema fixture does not execute Formula/what.rb"],
        "skip_reason": "Schema validation does not audit or build Formula source."
      },
      {
        "name": "bottle_build",
        "status": "skipped",
        "passed": [],
        "failed": [],
        "skipped": ["fixture does not build or upload bottle bytes"],
        "skip_reason": "The checked-in schema fixture does not publish artifacts."
      },
      {
        "name": "node_smoke",
        "status": "success",
        "passed": [
          "example executable completed under the Kandelo Node runtime"
        ],
        "failed": [],
        "skipped": []
      },
      {
        "name": "browser_smoke",
        "status": "skipped",
        "passed": [],
        "failed": [],
        "skipped": ["browser_compatible is false in this fixture"],
        "skip_reason": "Browser validation uses published tap artifacts, not schema fixtures."
      }
    ]
  },
  "metadata": {
    "metadata_json": {
      "path": "Kandelo/metadata.json",
      "sha256": "1111111111111111111111111111111111111111111111111111111111111111"
    },
    "formula_json": {
      "path": "Kandelo/formula/what.json",
      "sha256": "2222222222222222222222222222222222222222222222222222222222222222"
    },
    "link_manifest_json": {
      "path": "Kandelo/link/what-15.0.0-rebuild0-wasm32.json",
      "sha256": "3333333333333333333333333333333333333333333333333333333333333333"
    },
    "provenance_json": {
      "path": "Kandelo/reports/what-15.0.0-rebuild0-wasm32.provenance.json",
      "sha256": "4444444444444444444444444444444444444444444444444444444444444444"
    }
  }
}
